{
  "$schema": "./stationary-layout.schema-1.0.0.json",
  "schemaVersion": "1.0.0",
  "profileId": "open-triage.stationary.full-record",
  "catalog": {
    "release": "3.5.1",
    "dataset": "EMSDataSet",
    "elementCount": 453,
    "groupCount": 88
  },
  "customNamespaces": [],
  "groups": [
    {
      "id": "EMSDataSet",
      "parentId": null,
      "mode": "read-only",
      "presentation": {
        "kind": "inline",
        "label": "EMSDataSet"
      }
    },
    {
      "id": "HeaderGroup",
      "parentId": "EMSDataSet",
      "mode": "read-only",
      "presentation": {
        "kind": "table",
        "label": "Header",
        "help": "Add or edit Header entries.",
        "dialog": {
          "addLabel": "Add Header",
          "editLabel": "Edit Header"
        },
        "columns": [
          {
            "elementId": "dAgency.01"
          },
          {
            "elementId": "dAgency.02"
          },
          {
            "elementId": "dAgency.04"
          },
          {
            "elementId": "eAirway.01"
          }
        ]
      }
    },
    {
      "id": "DemographicGroup",
      "parentId": "HeaderGroup",
      "mode": "read-only",
      "presentation": {
        "kind": "inline",
        "label": "DemographicGroup"
      }
    },
    {
      "id": "eCustomConfigurationSection",
      "parentId": "HeaderGroup",
      "mode": "read-only",
      "presentation": {
        "kind": "inline",
        "label": "eCustomConfiguration"
      }
    },
    {
      "id": "eCustomConfiguration.eCustomGroup",
      "parentId": "eCustomConfigurationSection",
      "mode": "read-only",
      "presentation": {
        "kind": "table",
        "label": "eCustomConfiguration.CustomGroup",
        "help": "Add or edit eCustomConfiguration.CustomGroup entries.",
        "dialog": {
          "addLabel": "Add eCustomConfiguration.CustomGroup",
          "editLabel": "Edit eCustomConfiguration.CustomGroup"
        },
        "columns": [
          {
            "elementId": "eCustomConfiguration.01"
          },
          {
            "elementId": "eCustomConfiguration.02"
          },
          {
            "elementId": "eCustomConfiguration.03"
          },
          {
            "elementId": "eCustomConfiguration.04"
          }
        ]
      }
    },
    {
      "id": "PatientCareReportGroup",
      "parentId": "HeaderGroup",
      "mode": "editable",
      "presentation": {
        "kind": "table",
        "label": "PatientCareReport",
        "help": "Add or edit PatientCareReport entries.",
        "dialog": {
          "addLabel": "Add PatientCareReport",
          "editLabel": "Edit PatientCareReport"
        },
        "columns": [
          {
            "elementId": "eAirway.01"
          },
          {
            "elementId": "eAirway.02"
          },
          {
            "elementId": "eAirway.03"
          },
          {
            "elementId": "eAirway.04"
          }
        ]
      }
    },
    {
      "id": "eRecordSection",
      "parentId": "PatientCareReportGroup",
      "mode": "editable",
      "presentation": {
        "kind": "inline",
        "label": "eRecord"
      }
    },
    {
      "id": "eRecord.SoftwareApplicationGroup",
      "parentId": "eRecordSection",
      "mode": "editable",
      "presentation": {
        "kind": "inline",
        "label": "eRecord.SoftwareApplicationGroup"
      }
    },
    {
      "id": "eResponseSection",
      "parentId": "PatientCareReportGroup",
      "mode": "editable",
      "presentation": {
        "kind": "inline",
        "label": "eResponse"
      }
    },
    {
      "id": "eResponse.AgencyGroup",
      "parentId": "eResponseSection",
      "mode": "editable",
      "presentation": {
        "kind": "inline",
        "label": "eResponse.AgencyGroup"
      }
    },
    {
      "id": "eResponse.ServiceGroup",
      "parentId": "eResponseSection",
      "mode": "editable",
      "presentation": {
        "kind": "inline",
        "label": "eResponse.ServiceGroup"
      }
    },
    {
      "id": "eDispatchSection",
      "parentId": "PatientCareReportGroup",
      "mode": "editable",
      "presentation": {
        "kind": "inline",
        "label": "eDispatch"
      }
    },
    {
      "id": "eCrewSection",
      "parentId": "PatientCareReportGroup",
      "mode": "editable",
      "presentation": {
        "kind": "inline",
        "label": "eCrew"
      }
    },
    {
      "id": "eCrew.CrewGroup",
      "parentId": "eCrewSection",
      "mode": "editable",
      "presentation": {
        "kind": "table",
        "label": "eCrew.CrewGroup",
        "help": "Add or edit eCrew.CrewGroup entries.",
        "dialog": {
          "addLabel": "Add eCrew.CrewGroup",
          "editLabel": "Edit eCrew.CrewGroup"
        },
        "columns": [
          {
            "elementId": "eCrew.01"
          },
          {
            "elementId": "eCrew.02"
          },
          {
            "elementId": "eCrew.03"
          }
        ]
      }
    },
    {
      "id": "eTimesSection",
      "parentId": "PatientCareReportGroup",
      "mode": "editable",
      "presentation": {
        "kind": "inline",
        "label": "eTimes"
      }
    },
    {
      "id": "ePatientSection",
      "parentId": "PatientCareReportGroup",
      "mode": "editable",
      "presentation": {
        "kind": "inline",
        "label": "ePatient"
      }
    },
    {
      "id": "ePatient.PatientNameGroup",
      "parentId": "ePatientSection",
      "mode": "editable",
      "presentation": {
        "kind": "inline",
        "label": "ePatient.PatientNameGroup"
      }
    },
    {
      "id": "ePatient.AgeGroup",
      "parentId": "ePatientSection",
      "mode": "editable",
      "presentation": {
        "kind": "inline",
        "label": "ePatient.AgeGroup"
      }
    },
    {
      "id": "ePaymentSection",
      "parentId": "PatientCareReportGroup",
      "mode": "editable",
      "presentation": {
        "kind": "inline",
        "label": "ePayment"
      }
    },
    {
      "id": "ePayment.CertificateGroup",
      "parentId": "ePaymentSection",
      "mode": "editable",
      "presentation": {
        "kind": "inline",
        "label": "ePayment.CertificateGroup"
      }
    },
    {
      "id": "ePayment.InsuranceGroup",
      "parentId": "ePaymentSection",
      "mode": "editable",
      "presentation": {
        "kind": "table",
        "label": "ePayment.InsuranceGroup",
        "help": "Add or edit ePayment.InsuranceGroup entries.",
        "dialog": {
          "addLabel": "Add ePayment.InsuranceGroup",
          "editLabel": "Edit ePayment.InsuranceGroup"
        },
        "columns": [
          {
            "elementId": "ePayment.09"
          },
          {
            "elementId": "ePayment.10"
          },
          {
            "elementId": "ePayment.11"
          },
          {
            "elementId": "ePayment.12"
          }
        ]
      }
    },
    {
      "id": "ePayment.ClosestRelativeGroup",
      "parentId": "ePaymentSection",
      "mode": "editable",
      "presentation": {
        "kind": "inline",
        "label": "ePayment.ClosestRelativeGroup"
      }
    },
    {
      "id": "ePayment.EmployerGroup",
      "parentId": "ePaymentSection",
      "mode": "editable",
      "presentation": {
        "kind": "inline",
        "label": "ePayment.EmployerGroup"
      }
    },
    {
      "id": "ePayment.SupplyItemGroup",
      "parentId": "ePaymentSection",
      "mode": "editable",
      "presentation": {
        "kind": "table",
        "label": "ePayment.SupplyItemGroup",
        "help": "Add or edit ePayment.SupplyItemGroup entries.",
        "dialog": {
          "addLabel": "Add ePayment.SupplyItemGroup",
          "editLabel": "Edit ePayment.SupplyItemGroup"
        },
        "columns": [
          {
            "elementId": "ePayment.55"
          },
          {
            "elementId": "ePayment.56"
          }
        ]
      }
    },
    {
      "id": "eSceneSection",
      "parentId": "PatientCareReportGroup",
      "mode": "editable",
      "presentation": {
        "kind": "inline",
        "label": "eScene"
      }
    },
    {
      "id": "eScene.ResponderGroup",
      "parentId": "eSceneSection",
      "mode": "editable",
      "presentation": {
        "kind": "table",
        "label": "eScene.ResponderGroup",
        "help": "Add or edit eScene.ResponderGroup entries.",
        "dialog": {
          "addLabel": "Add eScene.ResponderGroup",
          "editLabel": "Edit eScene.ResponderGroup"
        },
        "columns": [
          {
            "elementId": "eScene.02"
          },
          {
            "elementId": "eScene.03"
          },
          {
            "elementId": "eScene.04"
          },
          {
            "elementId": "eScene.24"
          }
        ]
      }
    },
    {
      "id": "eSituationSection",
      "parentId": "PatientCareReportGroup",
      "mode": "editable",
      "presentation": {
        "kind": "inline",
        "label": "eSituation"
      }
    },
    {
      "id": "eSituation.PatientComplaintGroup",
      "parentId": "eSituationSection",
      "mode": "editable",
      "presentation": {
        "kind": "table",
        "label": "eSituation.PatientComplaintGroup",
        "help": "Add or edit eSituation.PatientComplaintGroup entries.",
        "dialog": {
          "addLabel": "Add eSituation.PatientComplaintGroup",
          "editLabel": "Edit eSituation.PatientComplaintGroup"
        },
        "columns": [
          {
            "elementId": "eSituation.03"
          },
          {
            "elementId": "eSituation.04"
          },
          {
            "elementId": "eSituation.05"
          },
          {
            "elementId": "eSituation.06"
          }
        ]
      }
    },
    {
      "id": "eSituation.WorkRelatedGroup",
      "parentId": "eSituationSection",
      "mode": "editable",
      "presentation": {